{
  "chain_name": "TerpNet",
  "status": "live",
  "network_type": "testnet",
  "pretty_name": "Terp-Net",
  "chain_id": "athena-1",
  "bech32_prefix": "terp",
  "daemon_name": "terp",
  "node_home": "$HOME/.terp",
  "genesis": {
    "genesis_url": 
"https://raw.githubusercontent.com/terpnetwork/test-net/master/athena-1/genesis.json"
  },
  "codebase": {
    "git_repo": "github.com/terpnetwork/terp-core",
    "recommended_version": "v0.1.0",
    "compatible_versions": [
      "v0.1.0"
    ],
    "binaries": {
      "linux/amd64": 
"https://github.com/terpnetwork/terp-core/archive/refs/tags/v0.1.0.tar.gz"
    }
  },
  "peers": {
    "seeds": [
      
      {
        "id": "5a6f4f80c7a29055028fc503216a1539594ad33f",
        "address": "89.111.15.146:11513"
      }
    ],
    "persistent_peers": [
      
      {
        "id": "7e5c0b9384a1b9636f1c670d5dc91ba4721ab1ca",
        "address": "23.88.53.28:36656"
      }
    ]
  },
  "apis": {
    "rpc": [
      {
        "address": "http://23.88.53.28:36657"
      },
      {
        "address": "https://rpc-terp.zenchainlabs.io/"
      },
      {
        "address": "https://terp-rpc.skynetvalidators.com/"
      },
      {
        "address": "https://terp-rpc.skynetvalidators.com/"
      }
      
    ],
    "rest": [
      {
        "address": "https://api-terp.zenchainlabs.io/",
        "provider": "Zenchain Labs"
      },
      {
        "address": "https://terp-api.skynetvalidators.com",
        "provider": "skynet validators"
      }
      
    ],
    "grpc": [
      {
        "address": "23.88.53.28:36090",
        "provider": "HighStakes"
      }
    ]
  }
}
