{
  "$schema": "../chain.schema.json",
  "chain_name": "teritori",
  "status": "live",
  "network_type": "mainnet",
  "pretty_name": "Teritori",
  "chain_id": "teritori-1",
  "daemon_name": "teritorid",
  "node_home": "$HOME/.teritorid",
  "bech32_prefix": "teri",
  "genesis": {
    "genesis_url": "https://github.com/TERITORI/teritori-mainnet-genesis/raw/main/genesis.json"
  },
  "slip44": 118,
  "fees": {
    "fee_tokens": [
      {
        "denom": "utori",
        "low_gas_price": 0.5,
        "average_gas_price": 0.75,
        "high_gas_price": 1
      }
    ]
  },
  "staking": {
    "staking_tokens": [
      {
        "denom": "utori"
      }
    ]
  },
  "codebase": {
    "git_repo": "https://github.com/TERITORI/teritori-chain",
    "recommended_version": "v1.0.0",
    "compatible_versions": [
      "v1.0.0"
    ]
  },
  "peers": {
    "seeds": [
      {
        "id": "20e1000e88125698264454a884812746c2eb4807",
        "address": "seeds.lavenderfive.com:15956",
        "provider": "Lavender.Five Nodes 🐝"
      }
    ]
  },
  "apis": {
    "rpc": [
      {
        "address": "https://teritori-rpc.lavenderfive.com:443",
        "provider": "Lavender.Five Nodes 🐝"
      }
    ],
    "rest": [
      {
        "address": "https://teritori-api.lavenderfive.com:443",
        "provider": "Lavender.Five Nodes 🐝"
      }
    ],
    "grpc": [
      {
        "address": "https://teritori-grpc.lavenderfive.com:443",
        "provider": "Lavender.Five Nodes 🐝"
      }
    ]
  },
  "explorers": [

  ]
}