{
  "$schema": "../chain.schema.json",
  "chain_name": "celestia",
  "chain_id": "celestia",
  "pretty_name": "Celestia",
  "status": "live",
  "network_type": "mainnet",
  "bech32_prefix": "celestia",
  "daemon_name": "celestia-appd",
  "node_home": "$HOME/.celestia-app",
  "key_algos": ["secp256k1"],
  "slip44": 118,
  "fees": {
    "fee_tokens": [
      {
        "denom": "utia",
        "fixed_min_gas_price": 0,
        "low_gas_price": 0.4,
        "average_gas_price": 0.1,
        "high_gas_price": 0.2
      }
    ]
  },
  "codebase": {
    "git_repo": "https://github.com/celestiaorg/celestia-app",
    "recommended_version": "v1.3.0",
    "compatible_versions": ["v1.3.0"],
    "genesis": {
      "genesis_url": "https://raw.githubusercontent.com/celestiaorg/networks/master/celestia/genesis.json"
    },
    "versions": [
      {
        "name": "v1.3.0",
        "recommended_version": "v1.3.0",
        "compatible_versions": ["v1.3.0"]
      }
    ]
  },
  "peers": {
    "seeds": [
      {
        "id": "f97a75fb69d3a5fe893dca7c8d238ccc0bd66a8f",
        "address": "celestia-blockspacerace.seed.brocha.in:30583",
        "provider": "Celestia Labs"
      }
    ]
  },
  "apis": {
    "rpc": [
      {
        "address": "https://rpc.lunaroasis.net",
        "provider": "Celestia Labs"
      }
    ],
    "rest": [
      {
        "address": "https://api.lunaroasis.net",
        "provider": "Celestia Labs"
      }
    ]
  },
  "explorers": [
    {
      "kind": "Mintscan",
      "url": "https://mintscan.io/celestia",
      "tx_page": "https://mintscan.io/celestia/txs/${txHash}"
    }
  ]
}
