{
  "$schema": "../chain.schema.json",
  "chain_name": "chronicnetwork",
  "status": "killed",
  "network_type": "mainnet",
  "pretty_name": "Chronic Chain",
  "chain_id": "morocco-1",
  "bech32_prefix": "chronic",
  "daemon_name": "chtd",
  "node_home": "$HOME/.cht",
  "key_algos": [
    "secp256k1"
  ],
  "slip44": 118,
  "fees": {
    "fee_tokens": [
      {
        "denom": "ucgas",
        "fixed_min_gas_price": 0.001
      }
    ]
  },
  "codebase": {
    "git_repo": "https://github.com/ChronicNetwork/cht",
    "recommended_version": "v1.1.0",
    "compatible_versions": [
      "v1.1.0"
    ],
    "binaries": {},
    "genesis": {},
    "versions": [
      {
        "name": "v1.1.0",
        "recommended_version": "v1.1.0",
        "compatible_versions": [],
        "binaries": {}
      }
    ]
  },
  "peers": {
    "seeds": [],
    "persistent_peers": []
  },
  "apis": {
    "rpc": [],
    "rest": [],
    "grpc": []
  },
  "explorers": []
}
