{
  "$schema": "../../chain.schema.json",
  "chain_name": "doravotatestnet",
  "chain_id": "doravota-devnet",
  "pretty_name": "Dora Vota Testnet",
  "status": "live",
  "network_type": "testnet",
  "bech32_prefix": "dora",
  "daemon_name": "dorad",
  "node_home": "$HOME/.dora",
  "key_algos": [
    "secp256k1"
  ],
  "slip44": 118,
  "fees": {
    "fee_tokens": [
      {
        "denom": "uDORA",
        "fixed_min_gas_price": 0.0025
      }
    ]
  },
  "staking": {
    "staking_tokens": [
      {
        "denom": "uDORA"
      }
    ]
  },
  "codebase": {
    "git_repo": "https://github.com/dorafactory/doravota",
    "recommended_version": "v11.0.0",
    "compatible_versions": [
      "v11.0.0"
    ],
    "binaries": {
      "linux/amd64": "https://github.com/cosmos/gaia/releases/download/v11.0.0/gaiad-v11.0.0-linux-amd64",
      "linux/arm64": "https://github.com/cosmos/gaia/releases/download/v11.0.0/gaiad-v11.0.0-linux-arm64",
      "darwin/amd64": "https://github.com/cosmos/gaia/releases/download/v11.0.0/gaiad-v11.0.0-darwin-amd64",
      "darwin/arm64": "https://github.com/cosmos/gaia/releases/download/v11.0.0/gaiad-v11.0.0-darwin-arm64",
      "windows/amd64": "https://github.com/cosmos/gaia/releases/download/v11.0.0/gaiad-v11.0.0-windows-amd64.exe",
      "windows/arm64": "https://github.com/cosmos/gaia/releases/download/v11.0.0/gaiad-v11.0.0-windows-arm64.exe"
    },
    "genesis": {
      "genesis_url": "https://github.com/cosmos/testnets/raw/master/public/genesis.json.gz"
    },
    "versions": [
      {
        "name": "v9.0.1",
        "recommended_version": "v9.0.1",
        "compatible_versions": [
          "v9.0.1"
        ],
        "binaries": {
          "linux/amd64": "https://github.com/cosmos/gaia/releases/download/v9.0.1/gaiad-v9.0.1-linux-amd64",
          "linux/arm64": "https://github.com/cosmos/gaia/releases/download/v9.0.1/gaiad-v9.0.1-linux-arm64",
          "darwin/amd64": "https://github.com/cosmos/gaia/releases/download/v9.0.1/gaiad-v9.0.1-darwin-amd64",
          "darwin/arm64": "https://github.com/cosmos/gaia/releases/download/v9.0.1/gaiad-v9.0.1-darwin-arm64",
          "windows/amd64": "https://github.com/cosmos/gaia/releases/download/v9.0.1/gaiad-v9.0.1-windows-amd64.exe"
        }
      },
      {
        "name": "v10.0.1",
        "recommended_version": "v10.0.1",
        "compatible_versions": [
          "v10.0.1"
        ],
        "binaries": {
          "linux/amd64": "https://github.com/cosmos/gaia/releases/download/v10.0.1/gaiad-v10.0.1-linux-amd64",
          "linux/arm64": "https://github.com/cosmos/gaia/releases/download/v10.0.1/gaiad-v10.0.1-linux-arm64",
          "darwin/amd64": "https://github.com/cosmos/gaia/releases/download/v10.0.1/gaiad-v10.0.1-darwin-amd64",
          "darwin/arm64": "https://github.com/cosmos/gaia/releases/download/v10.0.1/gaiad-v10.0.1-darwin-arm64",
          "windows/amd64": "https://github.com/cosmos/gaia/releases/download/v10.0.1/gaiad-v10.0.1-windows-amd64.exe"
        }
      },
      {
        "name": "v11",
        "recommended_version": "v11.0.0",
        "compatible_versions": [
          "v11.0.0"
        ],
        "binaries": {
          "linux/amd64": "https://github.com/cosmos/gaia/releases/download/v11.0.0/gaiad-v11.0.0-linux-amd64",
          "linux/arm64": "https://github.com/cosmos/gaia/releases/download/v11.0.0/gaiad-v11.0.0-linux-arm64",
          "darwin/amd64": "https://github.com/cosmos/gaia/releases/download/v11.0.0/gaiad-v11.0.0-darwin-amd64",
          "darwin/arm64": "https://github.com/cosmos/gaia/releases/download/v11.0.0/gaiad-v11.0.0-darwin-arm64",
          "windows/amd64": "https://github.com/cosmos/gaia/releases/download/v11.0.0/gaiad-v11.0.0-windows-amd64.exe",
          "windows/arm64": "https://github.com/cosmos/gaia/releases/download/v11.0.0/gaiad-v11.0.0-windows-arm64.exe"
        }
      }
    ]
  },
  "peers": {
    "seeds": [
    ],
    "persistent_peers": []
  },
  "apis": {
    "rpc": [
      {
        "address": "https://vota-rpc.dorafactory.org/",
        "provider": "dorafactory"
      }
    ],
    "rest": [
      {
        "address": "https://vota-rest.dorafactory.org",
        "provider": "dorafactory"
      }
    ],
    "grpc": [
    ]
  },
  "explorers": [
    {
      "kind": "Dora Vota Ping Pub",
      "url": "https://maci-explorer-test.dorafactory.org",
      "tx_page": "https://maci-explorer-test.dorafactory.org/dora/tx/${txHash}"
    }
  ]
}
