{
  "$schema": "../chain.schema.json",
  "chain_name": "carbon",
  "status": "live",
  "network_type": "mainnet",
  "pretty_name": "Carbon",
  "chain_id": "carbon-1",
  "bech32_prefix": "swth",
  "daemon_name": "carbond",
  "node_home": "$HOME/.carbond",
  "key_algos": [
    "secp256k1"
  ],
  "slip44": 118,
  "fees": {
    "fee_tokens": [
      {
        "denom": "swth",
        "fixed_min_gas_price": 0,
        "low_gas_price": 1,
        "average_gas_price": 1.5,
        "high_gas_price": 2
      },
      {
        "denom": "usc",
        "fixed_min_gas_price": 0,
        "low_gas_price": 1,
        "average_gas_price": 1.5,
        "high_gas_price": 2
      },
      {
        "denom": "bnb.1.6.773edb",
        "fixed_min_gas_price": 0,
        "low_gas_price": 1,
        "average_gas_price": 1.5,
        "high_gas_price": 2
      },
      {
        "denom": "bneo.1.14.e2e5f6",
        "fixed_min_gas_price": 0,
        "low_gas_price": 1,
        "average_gas_price": 1.5,
        "high_gas_price": 2
      },
      {
        "denom": "busd.1.6.754a80",
        "fixed_min_gas_price": 0,
        "low_gas_price": 1,
        "average_gas_price": 1.5,
        "high_gas_price": 2
      },
      {
        "denom": "eth.1.2.942d87",
        "fixed_min_gas_price": 0,
        "low_gas_price": 1,
        "average_gas_price": 1.5,
        "high_gas_price": 2
      },
      {
        "denom": "ibc/75249A18DEFBEFE55F83B1C70CAD234DF164F174C6BC51682EE92C2C81C18C93",
        "fixed_min_gas_price": 0,
        "low_gas_price": 1,
        "average_gas_price": 1.5,
        "high_gas_price": 2
      },
      {
        "denom": "ibc/A4DB47A9D3CF9A068D454513891B526702455D3EF08FB9EB558C561F9DC2B701",
        "fixed_min_gas_price": 0,
        "low_gas_price": 1,
        "average_gas_price": 1.5,
        "high_gas_price": 2
      },
      {
        "denom": "ibc/B7864B03E1B9FD4F049243E92ABD691586F682137037A9F3FCA5222815620B3C",
        "fixed_min_gas_price": 0,
        "low_gas_price": 1,
        "average_gas_price": 1.5,
        "high_gas_price": 2
      },
      {
        "denom": "ibc/ED07A3391A112B175915CD8FAF43A2DA8E4790EDE12566649D0C2F97716B8518",
        "fixed_min_gas_price": 0,
        "low_gas_price": 1,
        "average_gas_price": 1.5,
        "high_gas_price": 2
      },
      {
        "denom": "usdc.1.2.343151",
        "fixed_min_gas_price": 0,
        "low_gas_price": 1,
        "average_gas_price": 1.5,
        "high_gas_price": 2
      },
      {
        "denom": "usdc.1.6.53ff75",
        "fixed_min_gas_price": 0,
        "low_gas_price": 1,
        "average_gas_price": 1.5,
        "high_gas_price": 2
      }
    ]
  },
  "staking": {
    "staking_tokens": [
      {
        "denom": "swth"
      }
    ]
  },
  "codebase": {
    "git_repo": "https://github.com/Switcheo/carbon-bootstrap",
    "recommended_version": "v2.15.6",
    "compatible_versions": [
      "v2.15.6"
    ],
    "binaries": {
      "linux/amd64": "https://github.com/Switcheo/carbon-bootstrap/releases/download/v2.15.6/carbond2.15.6-mainnet.linux-amd64.tar.gz",
      "linux/arm64": "https://github.com/Switcheo/carbon-bootstrap/releases/download/v2.15.6/carbond2.15.6-mainnet.linux-arm64.tar.gz"
    },
    "genesis": {
      "genesis_url": "https://github.com/Switcheo/carbon-bootstrap/raw/master/carbon-1/genesis.json"
    }
  },
  "peers": {
    "seeds": [
      {
        "id": "d93ed6a1f43dd0904dc5e2ab8680d4049b057b17",
        "address": "13.215.17.91:26656",
        "provider": "switcheo-labs"
      },
      {
        "id": "70581c625fc1933bc273ca7a8d5e9ded3d1bcc97",
        "address": "13.213.113.113:26656",
        "provider": "switcheo-labs"
      },
      {
        "id": "e3f02a9f3ca22724b3a67bba9183113645c9c7d9",
        "address": "54.179.11.177:26656",
        "provider": "switcheo-labs"
      }
    ],
    "persistent_peers": [
      {
        "id": "b638cc8fc5b3d7867281081efce15e5a989339ac",
        "address": "188.166.191.195:26656",
        "provider": "intsol"
      },
      {
        "id": "aa238fc5a6b3f2a305a4ffb56a636ce14adce371",
        "address": "alice.peers.carbon.bh.rocks:26656",
        "provider": "BlockHunters"
      }
    ]
  },
  "apis": {
    "rpc": [
      {
        "address": "https://tm-api.carbon.network",
        "provider": "switcheo-labs"
      },
      {
        "address": "https://rpc.carbon.bh.rocks",
        "provider": "BlockHunters"
      }
    ],
    "rest": [
      {
        "address": "https://api.carbon.network",
        "provider": "switcheo-labs"
      },
      {
        "address": "https://rest.carbon.bh.rocks",
        "provider": "BlockHunters"
      }
    ]
  },
  "explorers": [
    {
      "kind": "carbonscan",
      "url": "https://scan.carbon.network",
      "tx_page": "https://scan.carbon.network/transaction/${txHash}?net=main"
    }
  ]
}
