{
  "$schema": "../chain.schema.json",
  "chain_name": "planq",
  "status": "live",
  "network_type": "mainnet",
  "pretty_name": "Planq",
  "chain_id": "planq_7070-2",
  "bech32_prefix": "plq",
  "node_home": "$HOME/.planqd",
  "genesis": {
    "genesis_url": "https://archive.evmos.org/mainnet/genesis.json"
  },
  "daemon_name": "planqd",
  "slip44": 60,
  "fees": {
    "fee_tokens": [
      {
        "denom": "aplanq",
        "low_gas_price": 10000000000,
        "average_gas_price": 25000000000,
        "high_gas_price": 40000000000
      }
    ]
  },
  "staking": {
    "staking_tokens": [
        {
            "denom": "aplanq"
        }
    ]
  },
  "codebase": {
    "git_repo": "https://github.com/planq-network/planq",
    "recommended_version": "v1.0.0",
    "compatible_versions": ["v1.0.0"]
  },
  "peers": {
    "seeds": [
      {
        "id": "dd2f0ceaa0b21491ecae17413b242d69916550ae",
        "address": "135.125.247.70:26656",
        "provider": "Planq Foundation EU"
      },
      {
        "id": "0525de7e7640008d2a2e01d1a7f6456f28f3324c",
        "address": "51.79.142.6:26656",
        "provider": "Planq Foundation SG"
      },
      {
        "id": "21432722b67540f6b366806dff295849738d7865",
        "address": "139.99.223.241:26656",
        "provider": "Planq Foundation AU"
      }
    ],
    "persistent_peers": [
      {
        "id": "dd2f0ceaa0b21491ecae17413b242d69916550ae",
        "address": "135.125.247.70:26656",
        "provider": "Planq Foundation EU"
      }
    ]
  },
  "apis": {
    "rpc": [
      {
        "address": "https://rpc.planq.network",
        "provider": "planq.network"
      }
    ],
    "rest": [
      {
        "address": "https://rest.planq.network",
        "provider": "planq.network"
      }
    ],
    "grpc": [
      {
        "address": "https://grpc.planq.network",
        "provider": "planq.network"
      }
    ],
    "evm-http-jsonrpc": [
      {
        "address": "https://evm-rpc.planq.network",
        "provider": "planq.network"
      }
    ]
  },
  "explorers": [
    {
      "kind": "bigdipper",
      "url": "https://explorer.planq.network",
      "tx_page": "https://explorer.planq.network/transactions/${txHash}"
    },
    {
      "kind": "blockscout",
      "url": "https://evm.planq.network",
      "tx_page": "https://evm.planq.network/tx/${txHash}"
    }
  ]
}
