{
  "$schema": "../chain.schema.json",
  "chain_name": "lumenx",
  "status": "live",
  "network_type": "mainnet",
  "pretty_name": "LumenX",
  "chain_id": "LumenX",
  "bech32_prefix": "lumen",
  "daemon_name": "lumenxd",
  "node_home": "$HOME/.lumenx",
  "key_algos": [
    "secp256k1"
  ],
  "slip44": 118,
  "fees": {
    "fee_tokens": [
      {
        "denom": "ulumen",
        "fixed_min_gas_price": 0.0025
      }
    ]
  },
  "codebase": {
    "git_repo": "https://github.com/metaprotocol-ai/lumenx",
    "recommended_version": "v0.1.0",
    "compatible_versions": [
      "v0.1.0"
    ],
    "genesis": {
      "genesis_url": "https://raw.githubusercontent.com/metaprotocol-ai/lumenx/master/config/genesis.json"
    }
  },
  "peers": {
    "seeds": [],
    "persistent_peers": []
  },
  "apis": {
    "rpc": [
      {
        "address": "https://rpc.lumenx.chaintools.tech/",
        "provider": "ChainTools"
      },
      {
        "address": "https://rpc-lumenx.cryptonet.pl/",
        "provider": "CryptoNet"
      }
    ],
    "rest": [
      {
        "address": "https://api.lumenx.chaintools.tech/",
        "provider": "ChainTools"
      },
      {
        "address": "https://api-lumenx.cryptonet.pl/",
        "provider": "CryptoNet"
      }
    ]
  },
  "explorers": [
    {
      "kind": "ping.pub",
      "url": "https://explorer.chaintools.tech/lumenx",
      "tx_page": "https://explorer.chaintools.tech/lumenx/tx/${txHash}"
    }
  ]
}