{
  "$schema": "../../chain.schema.json",
  "chain_name": "deardogstestnet",
  "chain_id": "vota-flatsat",
  "pretty_name": "Dear Dogs Testnet",
  "status": "live",
  "network_type": "testnet",
  "bech32_prefix": "dora",
  "daemon_name": "dorad",
  "node_home": "$HOME/.dora",
  "key_algos": [
    "secp256k1"
  ],
  "slip44": 118,
  "fees": {
    "fee_tokens": [
      {
        "denom": "peaka",
        "fixed_min_gas_price": 100000000000
      }
    ]
  },
  "staking": {
    "staking_tokens": [
      {
        "denom": "peaka"
      }
    ]
  },
  "codebase": {
    "git_repo": "https://github.com/dorafactory/doravota",
    "recommended_version": "v11.0.0",
    "compatible_versions": [
      "v11.0.0"
    ],
    "binaries": {
    },
    "genesis": {
      "genesis_url": "https://github.com/DoraFactory/doravota/blob/main/config/testnet/genesis.json"
    },
    "versions": [
      {
        "name": "v9.0.1",
        "recommended_version": "v9.0.1",
        "compatible_versions": [
          "v9.0.1"
        ],
        "binaries": {
        }
      },
      {
        "name": "v10.0.1",
        "recommended_version": "v10.0.1",
        "compatible_versions": [
          "v10.0.1"
        ],
        "binaries": {
        }
      },
      {
        "name": "v11",
        "recommended_version": "v11.0.0",
        "compatible_versions": [
          "v11.0.0"
        ],
        "binaries": {
        }
      }
    ]
  },
  "peers": {
    "seeds": [
    ],
    "persistent_peers": []
  },
  "apis": {
    "rpc": [
      {
        "address": "https://doge-testnet-rpc.dorafactory.org",
        "provider": "dorafactory"
      }
    ],
    "rest": [
      {
        "address": "https://doge-testnet-rest.dorafactory.org",
        "provider": "dorafactory"
      }
    ],
    "grpc": [
      {
        "address": "doge-testnet-grpc.dorafactory.org:443",
        "provider": "dorafactory"
      }
    ]
  },
  "explorers": [
    {
      "kind": "Dear Dogs Ping Pub",
      "url": "https://doge-testnet-explorer.dorafactory.org",
      "tx_page": "https://doge-testnet-explorer.dorafactory.org/deardogstestnet/tx/${txHash}"
    }
  ]
}
