{
    "$schema": "../../chain.schema.json",
    "chain_name": "kujira",
    "chain_id": "kaiyo-1",
    "pretty_name": "Kujira",
    "status": "live",
    "network_type": "mainnet",
    "bech32_prefix": "kujira",
    "genesis": {
        "genesis_url": "https://github.com/Team-Kujira/networks/raw/master/mainnet/kaiyo-1.json"
    },
    "daemon_name": "kujirad",
    "node_home": "$HOME/.kujira",
    "key_algos": [
        "secp256k1"
    ],
    "slip44": 118,
    "fees": {
        "fee_tokens": [
            {
                "denom": "ukuji",
                "fixed_min_gas_price": 0
            }
        ]
    },
    "codebase": {
        "git_repo": "https://github.com/Team-Kujira/core",
        "recommended_version": "v0.4.0",
        "compatible_versions": [
            "v0.4.0"
        ]
    },
    "apis": {
        "rpc": [
            {
                "address": "https://kujira-rpc.polkachu.com",
                "provider": "polkachu"
            }
        ],
        "rest": [
            {
                "address": "https://kujira-api.polkachu.com/",
                "provider": "polkachu"
            }
        ]
    },
    "explorers": [
        {
            "kind": "explorers.guru",
            "url": "https://kujira.explorers.guru",
            "tx_page": "https://kujira.explorers.guru/transaction/${txHash}"
        }
    ]
}
