{
    "$schema": "../chain.schema.json",
    "chain_name": "terpnettestnet",
    "status": "upcoming",
    "network_type": "mainnet",
    "pretty_name": "Terp-Network",
    "chain_id": "morocco-1",
    "bech32_prefix": "terp",
    "daemon_name": "terp",
    "node_home": "$HOME/.terp",
    "codebase": {
      "git_repo": "https://github.com/terpnetwork/terp-core.git",
      "recommended_version": "v1.0.0",
      "consensus": {
        "type": "cometbft",
        "version": "0.37.0"
      },
      "compatible_versions": [
        "v1.0.0"
      ],
      
      "genesis": {
        "genesis_url": ""
      },
      "binaries": {
        "linux/amd64": "https://github.com/terpnetwork/terp-core/archive/refs/tags/v1.0.0.tar.gz"
      },
      "versions": [
        {
          "name": "v1.0.0",
          "recommended_version": "v1.0.0",
          "compatible_versions": [
            "v1.0.0"
          ],
          "consensus": {
            "type": "cometbft",
            "version": "0.37.0"
          },
          "binaries": {
            "linux/amd64": "https://github.com/terpnetwork/terp-core/archive/refs/tags/v1.0.0.tar.gz"
        }
        }
      ]
    },
    "peers": {
      "seeds": [],
      "persistent_peers": [
        {
          "id": "",
          "address": ""
        }
      ]
    },
    "apis": {
      "rpc": [
        {
          "address": "",
          "provider": ""
        }
      ],
      "rest": [
        {
            "address": "",
            "provider": ""
        }
      ],
      "grpc": [
        {
            "address": "",
            "provider": ""
        }
      ]
    },
    "explorers": [
      {
        "kind": "",
        "url": "",
        "tx_page": ""
      }
    ]
  }