{
  "$schema": "../../chain.schema.json",
  "chain_name": "medasdigital-test",
  "status": "live",
  "network_type": "testnet",
  "pretty_name": "MedasDigital-Testnet",
  "chain_id": "medasdigital-test",
  "bech32_prefix": "medas",
  "daemon_name": "medasdigitald",
  "node_home": "$HOME/.medasdigital",
  "genesis": {
    "genesis_url": "https://github.com/oxygene76/medasdigital/tree/main/networks/testnet/genesis.json"
  },
  "key_algos": [
    "secp256k1"
  ],
  "slip44": 909,
  "fees": {
    "fee_tokens": [
      {
        "denom": "umedas",
        "fixed_min_gas_price": 0
      }
    ]
  },
  "codebase": {
    "git_repo": "https://github.com/oxygene76/medasdigital/",
    "recommended_version": "v0.1.0",
    "compatible_versions": [
      "v0.1.0"
    ]
  },
  "peers": {
    "persistent_peers": [
      {
        "id": "285378860d713ea3d544fddada9f4fe4e2bfd661",
        "address": "212.6.182.248:26656",
        "provider": "medas"
      },
      {
        "id": "16e82117d8ba811d84ab3e46e61cc809e108631e",
        "address": "212.6.182.248:26856",
        "provider": "medas"
      },
      {
        "id": "962d5a638d4dbc7accf3864bc49cfb16e2cfede8",
        "address": "212.6.182.242:26756",
        "provider": "medas"
      },
      {
        "id": "c77539667db234823d034e65a14f4f98a8fac082",
        "address": "64.251.18.192:26656",
        "provider": "medas"
      }
    ]
  },
  "apis": {
    "rpc": [
      {
        "address": "https://rpc.testnet.medas-digital.io:26657/",
        "provider": "medas"
      }
    ],
    "grpc": [
      {
        "address": "grpc.testnet.medas-digital.io:9090",
        "provider": "medas"
      }
    ],
    "rest": [
      {
        "address": "https://rest.testnet.medas-digital.io:1317/",
        "provider": "medas"
      }
    ]
  },
  "explorers": [
    {
      "kind": "bigdipper",
      "url": "http://explorer.testnet.medas-digital.io/",
      "tx_page": "http://explorer.testnet.medas-digital.io/transactions/${txHash}"
    }
  ]
}
