{
    "$schema": "../chain.schema.json",
    "chain_name": "microtick",
    "status": "live",
    "network_type": "mainnet",
    "pretty_name": "Microtick",
    "chain_id": "microtick-1",
    "bech32_prefix": "micro",
    "daemon_name": "mtm",
    "genesis": {
        "genesis_url": "https://raw.githubusercontent.com/microtick/stargate-genesis/master/genesis.json"
    },
    "codebase": {
        "git_repo": "https://github.com/microtick/mtzone",
        "recommended_version": "mtm-v2.0.5",
        "compatible_versions": [
            "mtm-v2.0.5"
        ]
    },
    "peers": {
        "seeds": [
            {
                "id": "922043cd83af759dd5a0605b32991667e8fd4977",
                "address": "45.79.207.112:26656",
                "provider": "Microtick"
            },
            {
                "id": "885cc6b8bcc36d9fd0489f4bfa2d845c9b60f354",
                "address": "5.189.132.164:26656",
                "provider": "Spanish Node"
            },
            {
                "id": "9dc9863a6091f251de72d92d88141ddcf93a6ac2",
                "address": "46.226.128.217:26656",
                "provider": "3Tekos"
            }
        ]
    },
    "apis": {
        "rpc": [
            {
                "address": "https://api.microtick.zone/",
                "provider": "Microtick"
            },
            {
                "address": "http://95.217.109.223:26657",
                "provider": "Microtick"
            },
            {
                "address": "http://104.237.158.143:26657",
                "provider": "Microtick"
            }
        ]
    },
    "explorers": [
        {
            "kind": "ping-pub",
            "url": "https://ping.pub/microtick",
            "tx_page": "https://ping.pub/microtick/tx/${txHash}"
    },
        {
            "kind": "bigdipper",
            "url": "https://explorer.microtick.zone/",
            "tx_page": "https://explorer.microtick.zone/transactions/${txHash}"
        }
    ]
}
