{
    "$schema": "../chain.schema.json",
    "chain_name": "cerberus",
    "status": "live",
    "network_type": "mainnet",
    "pretty_name": "Cerberus",
    "chain_id": "cerberus-1",
    "bech32_prefix": "cerberus",
    "daemon_name": "cerberusd",
    "node_home": "$HOME/.cerberus",
    "genesis": {
        "genesis_url": "https://github.com/cerberus-zone/cerberus_genesis/blob/main/genesis.json"
    },
    "codebase": {
        "git_repo": "https://github.com/cerberus-zone/cerberus",
        "recommended_version": "v1.0.1",
        "compatible_versions": [
            "v1.0.1"
        ]
    },
    "peers": {
        "seeds": [
            {
                "id": "d8a04beba9fb95c70368b303f701c36b4e3b4a63",
                "address": "185.215.165.29:26656"
            }
        ],
        "persistent_peers": [
            {
                "id": "4c3abff6e4a3e93b84babfc95df854861f83ac82",
                "address": "cerberus-seed.blockpane.com:26656",
                "provider": "blockpane"
            }
        ]
    },
    "apis": {
        "rpc": [
            {
                "address": "https://rpc.cerberus.zone:26657/",
                "provider": "Cerberus"
            }
        ],
        "rest": [
            {
                "address": "https://api.cerberus.zone:1317/",
                "provider": "Cerberus"
            }
        ]
    },
    "explorers": [
        {
            "kind": "ping.pub",
            "url": "https://skynetexplorers.com/Cerberus",
            "tx_page": "https://skynetexplorers.com/Cerberus/tx/${txHash}"
        }
    ]
}