{
    "$schema": "../chain.schema.json",
    "chain_name": "secret",
    "status": "live",
    "network_type": "mainnet",
    "pretty_name": "Secret Network",
    "chain_id": "secret-4",
    "bech32_prefix": "secret",
    "daemon_name": "secretd",
    "node_home": "$HOME/.secretd",
    "apis": {
        "rest": [
            {
                "address": "https://api.secretapi.io",
                "provider": "chainofsecrets"
            }
        ]
    }
}
