{
    "$schema": "../chain.schema.json",
    "chain_name": "rebus",
    "status": "live",
    "network_type": "mainnet",
    "pretty_name": "Rebus",
    "chain_id": "reb_1111-1",
    "bech32_prefix": "rebus",
    "daemon_name": "rebusd",
    "node_home": "$HOME/.rebusd",
    "genesis": {
        "genesis_url": "https://github.com/rebuschain/rebus.mainnet/raw/master/reb_1111-1/genesis.zip"
    },
    "slip44": 118,
    "fees": {
        "fee_tokens": [
            {
                "denom": "arebus"
            }
        ]
    },
    "staking": {
        "staking_tokens": [
            {
                "denom": "arebus"
            }
        ]
    },
    "codebase": {
        "git_repo": "https://github.com/rebuschain/rebus.core",
        "recommended_version": "v0.1.0",
        "compatible_versions": [
            "v0.1.0"
        ]
    },
    "peers": {
        "seeds": [
            {
                "id": "9be95ccf0086b96b707115b7707ea73420b11b6b",
                "address": "159.223.152.53:26656"
            },
            {
                "id": "3a3e7123b9ae814b8d8517b6635d21b9ae45bf25",
                "address": "195.3.222.148:26656"
            },
            {
                "id": "d28516746773bfaeca4efa5537c0bf5990b8828e",
                "address": "65.21.229.33:27656"
            },
            {
                "id": "7197d316935ca7b7ac36da7d4a3a6df16cd286a7",
                "address": "93.170.72.118:26656"
            },
            {
                "id": "87102b5dd22c1d17f97197c078f23726ae3c6214",
                "address": "garagenodes.com:26656"
            },
            {
                "id": "b9b70240be5b970a4939ddd5cc9a45ff4be6c292",
                "address": "198.244.167.164:26656"
            },
            {
                "id": "9289288c444b781a18f13c69da42b99424442cbb",
                "address": "65.108.44.149:21656"
            },
            {
                "id": "f467e286567f94c89d39a5bcea0e1d68951299f9",
                "address": "146.59.81.204:34456"
            },
            {
                "id": "4ef77b2a17e71d2535b3c8ec11830708fc299705",
                "address": "209.222.98.90:26656"
            },
            {
                "id": "c301abd7abe536d7791eb139599a68ecaab4ffbc",
                "address": "65.108.6.121:26656"
            },
            {
                "id": "dda7abe32cc84a722cf6b1d2ee3b61ebe7ad71df",
                "address": "135.181.212.183:21656"
            },
            {
                "id": "07b84cf4b47a2e5ad251267716fe05bcf30330cd",
                "address": "65.21.170.3:29656"
            },
            {
                "id": "b4941d0929595b9f83d190559e1d7126fec91cb0",
                "address": "172.96.161.94:26656"
            },
            {
                "id": "ce8b36056ace01414fa7a92e43eaa5bfd8705dd4",
                "address": "138.201.141.76:26656"
            },
            {
                "id": "89ded0a3987d22e46b756fead439e2a4d25f23cb",
                "address": "185.144.99.30:26656"
            },
            {
                "id": "62859ddc0485dbb37b7442135b8d468c4b2222b3",
                "address": "65.108.132.239:36656"
            },
            {
                "id": "eeca453e3a1cf670c78e2255b8f0bd5a9443c30b",
                "address": "65.108.225.71:26656"
            },
            {
                "id": "a7dd6ba407b4567372073f0c675dc0fa9703929e",
                "address": "141.95.124.152:20106"
            },
            {
                "id": "170397e75ca2b0f4e9f3b1bb5d0d23f9b10f01c7",
                "address": "rebus-sentry-1.p2p.brocha.in:30544"
            },
            {
                "id": "c0b33353fb70d8d71dcb9c8848b3b4207bd56951",
                "address": "rebus-sentry-2.p2p.brocha.in:30547"
            },
            {
                "id": "e9fa8c32e4504013c37d04671a8882c9bfbc47a9",
                "address": "38.242.139.248:26656"
            },
            {
                "id": "fe11ed3335cbf0690d7f8f5cd6bcee025991e48e",
                "address": "213.239.218.199:26621"
            },
            {
                "id": "c88a9a3d3a41a164f8c1537514665e77ea0b54ac",
                "address": "[2a01:4f9:6b:2e5b::9]:26656"
            },
            {
                "id": "b8c42fcb311b47cdb8285b5697f661fbba5bf1a5",
                "address": "51.68.157.129:26656"
            },
            {
                "id": "e1ab57dc8fb74bc238351e063da4de1e4ed78696",
                "address": "142.44.143.93:26656"
            },
            {
                "id": "5882961bd31831bf912c0d5fe5486da100c75d6b",
                "address": "65.109.54.110:36656"
            },
            {
                "id": "011a80b75d4986be1c71267785341e172d4aa321",
                "address": "198.244.228.17:43656"
            },
            {
                "id": "f5ceadfe92dc08bb57a30977409c8b195b822dc7",
                "address": "194.34.232.124:26656"
            },
            {
                "id": "c876aaf9c3626272666bdd161155166e7534c2a0",
                "address": "65.108.206.56:31656"
            }
        ]
    },
    "apis": {
        "rpc": [
            {
                "address": "https://rebus.rpc.manticore.team:443/",
                "provider": "MantiCore"
            },
            {
                "address": "https://rpc.rebus.nodestake.top/",
                "provider": "NodeStake"
            }
        ],
        "rest": [
            {
                "address": "https://rebus.api.manticore.team:443/",
                "provider": "MantiCore"
            },
            {
                "address": "https://api.rebus.nodestake.top/",
                "provider": "NodeStake"
            }
        ],
        "grpc": [
            {
                "address": "https://rebus.grpc.manticore.team:443/",
                "provider": "MantiCore"
            },
            {
                "address": "https://grpc.rebus.nodestake.top/",
                "provider": "NodeStake"
            }
        ]
    },
    "explorers": [
        {
          "kind": "ping.pub",
          "url": "https://explorer.nodestake.top/rebus",
          "tx_page": "https://explorer.nodestake.top/rebus/txs/${txHash}"
        },
        {
          "kind": "ping.pub",
          "url": "https://mainnet.manticore.team/rebus",
          "tx_page": "https://mainnet.manticore.team/rebus/tx/${txHash}"
        }
      ]
}
