{
  "$schema": "../../chain.schema.json",
  "chain_name": "saagetestnet",
  "status": "live",
  "network_type": "testnet",
  "pretty_name": "Saage-Testnet-5",
  "chain_id": "sit-5",
  "bech32_prefix": "sge",
  "daemon_name": "saaged",
  "node_home": "$HOME/.saage",
  "genesis": {
    "genesis_url": "https://github.com/saage-tech/network-testnet-1/blob/master/networks/saage-testnet-5/genesis.json"
  },
  "key_algos": ["secp256k1"],
  "slip44": 909,
  "fees": {
    "fee_tokens": [
      {
        "denom": "usge",
        "fixed_min_gas_price": 0
      }
    ]
  },
  "codebase": {
    "git_repo": "https://github.com/saage-tech/saage-testnet-1",
    "recommended_version": "v0.6.0",
    "compatible_versions":["v0.6.0"]
  },
  "peers": {
    "persistent_peers": [
      {
        "id": "c1e005ef1d63a3e543d2542dffaabdd65a381bb3",
        "address": "3.82.54.192:26656",
        "provider": "devopsNexus"
      },
      {
        "id": "8313705fa5c5b1e4a8c45e99df8ed216604b9310",
        "address": "3.235.109.126:26656",
        "provider": "darkRealm"
      },
      {
        "id": "0a43064d5706673220a8a49f6fe144b8a1c53f7c",
        "address": "44.201.51.199:26656",
        "provider": "scorpionKing"
      },
      {
        "id": "80ccda3f9a1fb765036fa1b97b504a697189ec4f",
        "address": "3.235.167.226:26656",
        "provider": "nitka"
      },
      {
        "id": "8f5670953c3af833746d4d62fdda380e6500480d",
        "address": "54.187.111.220:26656",
        "provider": "nitka"
      },
      {
        "id": "f8d5f23f741ccbe7da0f7112e3e55bf0fde1e7b5",
        "address": "54.226.144.104:26656",
        "provider": "validictator"
      }
    ]
  },
  "apis": {
    "rpc": [
      {
        "address": "https://sentry.testnet.saage.io:26657/",
        "provider": "saage"
      }
    ],
    "grpc": [
      {
        "address": "sentry.testnet.saage.io:9090",
        "provider": "saage"
      }
    ],
    "rest": [
      {
          "address": "https://sentry.testnet.saage.io:1317/",
          "provider": "saage"
      }
    ]
  },
  "explorers": [
    {
      "kind": "bigdipper",
      "url": "https://blockexplorer-1.testnet.saage.io/",
      "tx_page": "https://blockexplorer-1.testnet.saage.io/transactions/{txHash}"
    }
  ]
}
