{
    "$schema": "../../chain.schema.json",
    "chain_name": "permtestnet",
    "status": "live",
    "network_type": "testnet",
    "pretty_name": "Perm Testnet",
    "chain_id": "testnet-1",
    "bech32_prefix": "perm",
    "daemon_name": "permd",
    "node_home": "$HOME/.perm",
    "key_algos": [
      "secp256k1"
    ],
    "slip44": 118,
    "fees": {
      "fee_tokens": [
        {
          "denom": "uperm",
          "low_gas_price": 0.0025,
          "average_gas_price": 0.0025,
          "high_gas_price": 0.0024
        }
      ]
    },
    "staking": {
      "staking_tokens": [
        {
          "denom": "uperm"
        }
      ]
    },
    "codebase": {
      "git_repo": "https://github.com/Loop-Protocol/perm.git",
      "recommended_version": "v1.0.0",
      "compatible_versions": [
        "v1.0.0"
      ],
      "cosmos_sdk_version": "0.45",
      "consensus": {
        "type": "tendermint",
        "version": "0.34"
      },
      "cosmwasm_version": "0.30",
      "cosmwasm_enabled": true,
      "ibc_go_version": "4.3.0",
      "genesis": {
        "genesis_url": "https://raw.githubusercontent.com/Loop-Protocol/testnet/main/genesis.json"
      },
      "versions": [
        {
          "name": "v1.0.0",
          "recommended_version": "v1.0.0",
          "compatible_versions": [
            "v1.0.0"
          ],
          "cosmos_sdk_version": "0.45",
          "consensus": {
            "type": "tendermint",
            "version": "0.34"
          },
          "cosmwasm_version": "0.30",
          "cosmwasm_enabled": true,
          "ibc_go_version": "4.3.0"
        },
        {
          "name": "v1.0.0",
          "recommended_version": "v1.0.0",
          "compatible_versions": [
            "v1.0.0"
          ],
          "cosmos_sdk_version": "0.45",
          "consensus": {
            "type": "tendermint",
            "version": "0.34"
          },
          "cosmwasm_version": "0.30",
          "cosmwasm_enabled": true,
          "ibc_go_version": "4.3.0"
        }
      ]
    },
    "peers": {
      "seeds": [],
      "persistent_peers": []
    },
    "apis": {
      "rpc": [
        {
          "address": "http://perm-1-1412376094.ap-south-1.elb.amazonaws.com",
          "provider": "Perm Network"
        }
      ],
      "rest": [
        {
          "address": "http://pem-2-343400911.ap-south-1.elb.amazonaws.com/",
          "provider": "Perm Network"
        }
      ],
      "grpc": [
        {
          "address": "http://perm-3-913721738.ap-south-1.elb.amazonaws.com/",
          "provider": "Perm Network"
        }
      ]
    },
    "explorers": [
      {
        "kind": "bigdipper",
        "url": "https://explorer.testnet.perm.ooo/",
        "tx_page": "https://explorer.testnet.perm.ooo/transactions/${txHash}"
      }
    ]
  }