{
  "$schema": "../chain.schema.json",
  "chain_name": "quicksilver",
  "status": "live",
  "network_type": "mainnet",
  "pretty_name": "Quicksilver",
  "chain_id": "quicksilver-1",
  "daemon_name": "quicksilverd",
  "node_home": "$HOME/.quicksilver",
  "bech32_prefix": "quick",
  "slip44": 118,
  "fees": {
    "fee_tokens": [
      {
        "denom": "uqck",
        "fixed_min_gas_price": 0.0001
      }
    ]
  },
  "staking": {
    "staking_tokens": [
      {
        "denom": "uqck"
      }
    ]
  },
  "codebase": {
    "git_repo": "https://github.com/ingenuity-build/quicksilver",
    "recommended_version": "v1.0.0",
    "compatible_versions": [
      "v1.0.0"
    ],
    "genesis": {
      "genesis_url": "https://github.com/ingenuity-build/mainnet/raw/main/genesis.json"
    }
  },
  "peers": {
    "seeds": [],
    "persistent_peers": []
  },
  "apis": {
    "rpc": [
      {
        "address": "https://rpc.quicksilver.zone:443",
        "provider": "Quicksilver"
      },
      {
        "address": "https://rpc-quicksilver-ia.cosmosia.notional.ventures:443",
        "provider": "Notional"
      }
    ],
    "rest": [
      {
        "address": "http://lcd.quicksilver.zone:443/",
        "provider": "Quicksilver"
      },
      {
        "address": "https://api-quicksilver-ia.cosmosia.notional.ventures:443",
        "provider": "Notional"
      }
    ],
    "grpc": [
      {
        "address": "grpc-quicksilver-ia.cosmosia.notional.ventures:443",
        "provider": "Notional"
      }
    ]
  },
  "explorers": [
    {
      "kind": "mintscan",
      "url": "https://www.mintscan.io/quicksilver",
      "tx_page": "https://www.mintscan.io/quicksilver/txs/${txHash}",
      "account_page": "https://www.mintscan.io/quicksilver/account/${accountAddress}"
    }
  ]
}
